,review_id,review_rating,review_sentences
215,oF602fC4mZTYA9EgbgWl0Q,1,Server didn't know anything about the drink specials or what was considered a martini.
215,oF602fC4mZTYA9EgbgWl0Q,1,Didn't have broccoli salad or some of the other things I'm used to getting.
215,oF602fC4mZTYA9EgbgWl0Q,1,"Unfortunately, I don't see this location being open another 3 months and will most likely close like all the other locations if it doesn't change soon!"
216,PDAIxKiZ_bnbu2CnU1U_zg,5,EXCELLENT HOT.
216,PDAIxKiZ_bnbu2CnU1U_zg,5,Food.
216,PDAIxKiZ_bnbu2CnU1U_zg,5, Great value for quality.
216,PDAIxKiZ_bnbu2CnU1U_zg,5,Wonderful server!
216,PDAIxKiZ_bnbu2CnU1U_zg,5, The salad bar was well stocked although we did not participate.
216,PDAIxKiZ_bnbu2CnU1U_zg,5,It was offered however with our meal for extra cost.
216,PDAIxKiZ_bnbu2CnU1U_zg,5, All of us got BBQ.
216,PDAIxKiZ_bnbu2CnU1U_zg,5,Their signature hickory bourbon sauce is slightly spicy but sweet.
216,PDAIxKiZ_bnbu2CnU1U_zg,5,  We will stop again on our way to Ohio turnpike
217,hFEDDhyzTXRP2tsW1rJY_w,5,Went to RT for lunch today.
217,hFEDDhyzTXRP2tsW1rJY_w,5,Impressed that they were following all of the COVID protocols.
217,hFEDDhyzTXRP2tsW1rJY_w,5,Gas the 2 for 22 special.
217,hFEDDhyzTXRP2tsW1rJY_w,5,Food served was delicious!
217,hFEDDhyzTXRP2tsW1rJY_w,5,Had the honey glazed chicken and my wife had the tenders.
217,hFEDDhyzTXRP2tsW1rJY_w,5,Will be going back!
218,HW9OS_H3AmPNj668uUYF-g,2,"While food received was good, had grub hub delivery."
218,HW9OS_H3AmPNj668uUYF-g,2," Paid premium price, order incomplete."
218,HW9OS_H3AmPNj668uUYF-g,2, Customer Service passed did not resolve issue.
218,HW9OS_H3AmPNj668uUYF-g,2, NEVER use Grub Hub!
219,-xYFMYT-3Ua73ALVER13qQ,4,"I've been here a million times, usually 4-5 stars but today was 3-star for sure."
219,-xYFMYT-3Ua73ALVER13qQ,4, While it's not this locations responsibility - how do they not have an app?!
219,-xYFMYT-3Ua73ALVER13qQ,4,"And when I tried ordering online, it wouldn't go through so I had to call the order in."
219,-xYFMYT-3Ua73ALVER13qQ,4," Then, they messed the order up - I ordered chicken Parmesan with broccoli cheese soup ...got chicken Alfredo with broccoli."
219,-xYFMYT-3Ua73ALVER13qQ,4, Everything was good but not what I ordered & it was near closing so I couldn't do much about it.
219,-xYFMYT-3Ua73ALVER13qQ,4," Food is always great, service is solid & the salad bar is my favorite thing about BurgerPalace"
219,-xYFMYT-3Ua73ALVER13qQ,4, I look forward to more 5-star experiences in the future to make up for today's.
220,OO29ZmbQVUhsgAJASM7cwA,2,went here today buy 1 get1 use to love this place got shorted shrimp they dropped some said they be back never came ordered dirty rice brought something brought out some more so spicy an hot couldn't eat man I use to love that rice drinks were bad too place use to be a 8 or 9 sorry to see it go down hill got to be a 3 or 5 now wont be back there call me when you can turn things around there dam it was a good place onece
221,Ar8S4KIL3n14EFsJzdtazA,3,We were excited to see a salad bar again!
221,Ar8S4KIL3n14EFsJzdtazA,3,We come for the salad!
221,Ar8S4KIL3n14EFsJzdtazA,3,This location however wasnt the best.
221,Ar8S4KIL3n14EFsJzdtazA,3,Our waiter was stressed and we could see they were understaffed...part of why I didnt give a lower score.
221,Ar8S4KIL3n14EFsJzdtazA,3,I understand businesses are struggling for help.
221,Ar8S4KIL3n14EFsJzdtazA,3,We were patient waiting for service.
221,Ar8S4KIL3n14EFsJzdtazA,3,We all got salad bar and some an entree.
221,Ar8S4KIL3n14EFsJzdtazA,3,The salad bar was out of a lot of items and it did not look attended to.
221,Ar8S4KIL3n14EFsJzdtazA,3,"Even in understanding, it was frustrating as that was my meal."
221,Ar8S4KIL3n14EFsJzdtazA,3,The entress came out 27 mins later.
221,Ar8S4KIL3n14EFsJzdtazA,3,The tater tops were awesome and food was hot.
221,Ar8S4KIL3n14EFsJzdtazA,3,They were running a special 2 for $24 and add endless salad and drink on for $5.That
221,Ar8S4KIL3n14EFsJzdtazA,3,seemed a good deal!
221,Ar8S4KIL3n14EFsJzdtazA,3,We didnt see our waiter again till end of meal.
221,Ar8S4KIL3n14EFsJzdtazA,3,We received the bill and found we had been charged $5.99 for salad and $2.89 for drink that was to be $5 as printed on special menu.
221,Ar8S4KIL3n14EFsJzdtazA,3,We advised the waiter who stated we were wrong as he tried to tell us it was only on another special.
221,Ar8S4KIL3n14EFsJzdtazA,3,"Frustrated we pointed it out to him, and to his surprise we were right."
221,Ar8S4KIL3n14EFsJzdtazA,3,So we paid the bill and ledt only 15% for his tip.
221,Ar8S4KIL3n14EFsJzdtazA,3,Watch your tabs here!
222,QexiQXVzBaATA7ky_Ys7Ew,3,Server did a great job.
222,QexiQXVzBaATA7ky_Ys7Ew,3,Food was average and salad bar was less than average.
222,QexiQXVzBaATA7ky_Ys7Ew,3,Staff was very friendly.
223,H1cWMFRTfU46QEqJRSdVlw,1,Went there on Friday evening at 6pm.
223,H1cWMFRTfU46QEqJRSdVlw,1,They were not that busy.
223,H1cWMFRTfU46QEqJRSdVlw,1,We were seated rather quickly.
223,H1cWMFRTfU46QEqJRSdVlw,1,in about 10 min the waitress came over took our drink order and she asked us if we were ready to order and we did.
223,H1cWMFRTfU46QEqJRSdVlw,1,After 10 minutes we were still waiting for our drinks so I flagged the waitress down and asked for them.
223,H1cWMFRTfU46QEqJRSdVlw,1,I got the salad bar not impressed !
223,H1cWMFRTfU46QEqJRSdVlw,1,Husband ordered a bacon cheeseburger waited 50 minutes and had to flag her down again to ask for the check as we had to leave to get to our movie.
223,H1cWMFRTfU46QEqJRSdVlw,1,She said hold on then goes to kitchen and brings out his food out she says do you still want it and we said no because we can't take it into the movies!
223,H1cWMFRTfU46QEqJRSdVlw,1,So she says well you don't have to pay for salad bar or drinks.
223,H1cWMFRTfU46QEqJRSdVlw,1,Which we would have but
223,H1cWMFRTfU46QEqJRSdVlw,1,in a nut shell it was all ridiculous no reason that it should have taken so long!
223,H1cWMFRTfU46QEqJRSdVlw,1,Won't be going there again!
224,0w9ddA8z3FSikDcIxPRvAA,2,There were two hard clear plastic pieces of plastic mixed into my salad.
224,0w9ddA8z3FSikDcIxPRvAA,2, Disappointed.
225,sOi42X-Ba4OBh5DQEOaLgg,2,"This review is based only on the fact that they say that they are open until 10:00, yet when we got there at 9:13, the doors were locked and we could see employees looking at us."
225,sOi42X-Ba4OBh5DQEOaLgg,2," After a very long day of getting horses and ourselves ready and down to State Fair, we just wanted a quick, tasty meal, it was extremely frustrating to select a restaurant, get there and then be ignored :("
226,kJ87sXwpvo8TDFp65WJ5dg,2,I only go to this restaurant when other people want to.
226,kJ87sXwpvo8TDFp65WJ5dg,2, The main reason I never want to go is that is is sooo disgusting.
226,kJ87sXwpvo8TDFp65WJ5dg,2,"The floor is so nasty, it made my shoes stick."
226,kJ87sXwpvo8TDFp65WJ5dg,2, How can anyone that manages this restaurant not notice how dirty it is?
226,kJ87sXwpvo8TDFp65WJ5dg,2,"The windowsills are full of dead bugs, the blinds are splattered with old food and god knows what."
226,kJ87sXwpvo8TDFp65WJ5dg,2, And the floors.
226,kJ87sXwpvo8TDFp65WJ5dg,2, 
226,kJ87sXwpvo8TDFp65WJ5dg,2,Ugh.
226,kJ87sXwpvo8TDFp65WJ5dg,2, The floors look like something out of a dive bar in Guadalajara.
226,kJ87sXwpvo8TDFp65WJ5dg,2,"There have been a reviews about their floors from months ago, but obviously nothing was ever done."
226,kJ87sXwpvo8TDFp65WJ5dg,2," If the kitchen is even half as dirty, make sure your hepatitis shots are up to date!"
226,kJ87sXwpvo8TDFp65WJ5dg,2,That being said - the service is usually pretty decent and the drinks aren't half bad
227,sVmejjCHuPCN6rwzfmkMyg,1,Awful service.
227,sVmejjCHuPCN6rwzfmkMyg,1,Our entire order was missing the sides and drinks.
227,sVmejjCHuPCN6rwzfmkMyg,1,I called to talk to someone about fixing the issue and I got hung up on.
227,sVmejjCHuPCN6rwzfmkMyg,1,Twice.
227,sVmejjCHuPCN6rwzfmkMyg,1,"Then, when I called back again it took 5 minutes of ringing before they answered."
227,sVmejjCHuPCN6rwzfmkMyg,1,Then they proceeded to place me on hold for over 15 minutes.
227,sVmejjCHuPCN6rwzfmkMyg,1,I hung up.
227,sVmejjCHuPCN6rwzfmkMyg,1,"Never eat here, the staff is terrible."
228,KI9YkJmtqM7GO130t2pSzg,3,Food was good.
228,KI9YkJmtqM7GO130t2pSzg,3,"Had a couple of the mini me smokehouse burgers and a jalapeno burger, cooked well, the only thing that made this a 3 star rating was our waitress."
228,KI9YkJmtqM7GO130t2pSzg,3,She kept forgetting things in our order.
228,KI9YkJmtqM7GO130t2pSzg,3,She also kept complaining she had too many tables when there were about 6 tables for her.
229,gjhN11o5oXn2SORavk8krw,1,Friendly staff.
229,gjhN11o5oXn2SORavk8krw,1,This place is EXTREMELY DIRTY.
229,gjhN11o5oXn2SORavk8krw,1, I'm surprised they are still in operation.
230,tmH3oEvwewuCi3fvNohffA,1,"My Wife and I were here over a Month ago, and I had to write about this place.  After going to the Botanical Gardens, we decided to have Lunch here.  "
230,tmH3oEvwewuCi3fvNohffA,1,"We go in, and the Hostess seated us at a Booth which we wanted.  "
230,tmH3oEvwewuCi3fvNohffA,1,"As we're looking through the Menu, I noticed that the place had not been Vacuumed in who knows how long?!"
230,tmH3oEvwewuCi3fvNohffA,1," There was a smell there as well from the Carpet not being Vacuumed, and the Tables looked like they had not been Wiped Down in some time as well."
230,tmH3oEvwewuCi3fvNohffA,1,"We placed our Drink and Food order, and waited to close to an Hour for the Food to arrive!"
230,tmH3oEvwewuCi3fvNohffA,1," It wasn't crowded in there, so there should not have been an excuse for the Delay!"
230,tmH3oEvwewuCi3fvNohffA,1," After we got our Food, my Wife noticed that the 'Grilled Zucchini' was too Greasy to EAT!"
230,tmH3oEvwewuCi3fvNohffA,1," I tasted one, and it was!"
230,tmH3oEvwewuCi3fvNohffA,1," It was soaked in Grease for whatever reason, and it was AWFUL!"
230,tmH3oEvwewuCi3fvNohffA,1," I had the Chicken Tender Combo, and it wasn't great either."
230,tmH3oEvwewuCi3fvNohffA,1," Both of our orders tasted like the Chef and the Cooks in the Back did not care, and just sent out what they felt"
230,tmH3oEvwewuCi3fvNohffA,1,"like!Will not be returning here anytime soon, and I suggest you don't as well come here to eat for your Wallet and Stomach will thank you for not doing so!"
231,Jmt5osNy5xUsJfj_iZhcgA,1,This place has gone downhill fast.
231,Jmt5osNy5xUsJfj_iZhcgA,1,Ordered fried shrimp and it was foul looked like the kind that you buy in the frozen food section
232,TDGZQTOPJ6JkRN4uTAT42w,5,Came here today for lunch.
232,TDGZQTOPJ6JkRN4uTAT42w,5," My server was awesome, paid attention without hovering."
232,TDGZQTOPJ6JkRN4uTAT42w,5,"I got the backyard BBQ salad with a glass of wine, and carrot cake for dessert."
232,TDGZQTOPJ6JkRN4uTAT42w,5,All were delicious!
232,TDGZQTOPJ6JkRN4uTAT42w,5,"The salad bar was up and running, which I do love, but I'm not sure I'm ready for that yet."
233,_jcGCfvt2aSNEBeu6UF8Mw,1,Dear BurgerPalace no wonder you're going out of business.
233,_jcGCfvt2aSNEBeu6UF8Mw,1, We had 10 hungy people ready to eat and you turned us away?
233,_jcGCfvt2aSNEBeu6UF8Mw,1,Because you only have one server and one chef?
233,_jcGCfvt2aSNEBeu6UF8Mw,1,We would have gladly eaten the salad bar.
233,_jcGCfvt2aSNEBeu6UF8Mw,1, You still turned us away?
233,_jcGCfvt2aSNEBeu6UF8Mw,1,I guess you don't want our money or do you not like bikers?
234,YHJcRAYHmyE1l-ypDVVATg,1,"I have never been told that I can not be served and I need to leave a restaurant in my life, because I had a party of 5."
234,YHJcRAYHmyE1l-ypDVVATg,1,If you need to shut your doors and not be open I could unstained that.
234,YHJcRAYHmyE1l-ypDVVATg,1,BUT TO TOLD TO LEAVE AND TO BE RUDE ABOUT IT.
234,YHJcRAYHmyE1l-ypDVVATg,1,LETS SHUT THIS PLACE DOWN !!!!!!!
235,1nLv0FeD22mgm2osGP-g2g,3,No offense to BurgerPalace but my date and I went here sort of as a joke.
235,1nLv0FeD22mgm2osGP-g2g,3,We're on a tour of American chain restaurants and neither of us had been to BurgerPalace before.
235,1nLv0FeD22mgm2osGP-g2g,3,We were very pleasantly surprised!
235,1nLv0FeD22mgm2osGP-g2g,3,"I wasn't expecting the food to be that good, and keep in mind it is still a chain that probably gets a lot of frozen stuff from large food distributors, but it was a lovely meal overall!"
235,1nLv0FeD22mgm2osGP-g2g,3,"We started with the spinach artichoke dip, which was my least favorite item of the evening, kind of bland and obviously processed."
235,1nLv0FeD22mgm2osGP-g2g,3,We split a Smokehouse Burger topped with BBQ sauce and onion rings (pretty good) and this Asiago Bacon Chicken dish that was the real winner of the night.
235,1nLv0FeD22mgm2osGP-g2g,3,"Our server, Ashley, was friendly and quick to refill drinks."
235,1nLv0FeD22mgm2osGP-g2g,3,The molten lava cake could have used a little more lava but flavor wasn't bad.
235,1nLv0FeD22mgm2osGP-g2g,3,Skip the loaded tots though--the tots aren't crispy enough to carry the nacho cheese sauce and it just disintegrates into a lumpy mess.
236,ypfshyzTtme9Gjq9Zkadxg,1,"Husband and I went for meal, the waitress had no idea what the specials were, and we had to inform her of what should be offered as far as happy hour and the new Tex Mex menu."
236,ypfshyzTtme9Gjq9Zkadxg,1,She said no one ever orders from the Tex Mex menu so we skipped food and just got the salad bar.
236,ypfshyzTtme9Gjq9Zkadxg,1,"The place looked like it was still in COVID lock down, and people were turned away because of the wait (there was about 5 people in the place)."
236,ypfshyzTtme9Gjq9Zkadxg,1,"The carpet was dirty, the poor waitress was taking all orders and pouring drinks, and we think she was making the food."
236,ypfshyzTtme9Gjq9Zkadxg,1,"Good bye you sad, sad place."
237,MDmNozgAYxX0KNDNTbBuPA,1,"Alright, so the food was good."
237,MDmNozgAYxX0KNDNTbBuPA,1, The one star is for that.
237,MDmNozgAYxX0KNDNTbBuPA,1, It has been a long time since I had been to any BurgerPalace and at least I can say the food was up to par to what I remember.
237,MDmNozgAYxX0KNDNTbBuPA,1,"No stars for the service the evening I went with my cousins, last Saturday."
237,MDmNozgAYxX0KNDNTbBuPA,1, Did not know that they weren't seating parties of 8 (we had 2 4 people families).
237,MDmNozgAYxX0KNDNTbBuPA,1,"That's fine, but we came in TOGETHER so I would think that sitting them close to each would be the most appropriate thing to do."
237,MDmNozgAYxX0KNDNTbBuPA,1, 
237,MDmNozgAYxX0KNDNTbBuPA,1,Nope.
237,MDmNozgAYxX0KNDNTbBuPA,1, We were seated into the bar area and my cousins were in a booth.
237,MDmNozgAYxX0KNDNTbBuPA,1,And not close.
237,MDmNozgAYxX0KNDNTbBuPA,1, My kids and her kids couldn't play and see each other and the adults couldn't talk.
237,MDmNozgAYxX0KNDNTbBuPA,1, Couldn't even see each other.
237,MDmNozgAYxX0KNDNTbBuPA,1," I wondered why, oh emyeah, because the tables were not cleaned."
237,MDmNozgAYxX0KNDNTbBuPA,1," Hmmmm... and then our waiter....please, he was more interested in cleaning the bar then taking care of his table."
237,MDmNozgAYxX0KNDNTbBuPA,1," I understand that it was 9 p.m. at night but guess what, a customer is still a customer."
237,MDmNozgAYxX0KNDNTbBuPA,1,My cousin said their waiter was excellent and attentive.
237,MDmNozgAYxX0KNDNTbBuPA,1, Too bad we didn't have the same one.
237,MDmNozgAYxX0KNDNTbBuPA,1," When I went on to leave my review, I saw that this location got 2 and half stars."
237,MDmNozgAYxX0KNDNTbBuPA,1, I see why.
237,MDmNozgAYxX0KNDNTbBuPA,1," Again, food, Great."
237,MDmNozgAYxX0KNDNTbBuPA,1, Too bad the service didn't match the taste.
238,jMcRUW_MF8hM38p54QYmbQ,1,Food was ok bit not ok!
238,jMcRUW_MF8hM38p54QYmbQ,1,"I asked for a loaded baked potato and it was not loaded, had hardly no cheese, bacon, no butter no salt nor pepper."
238,jMcRUW_MF8hM38p54QYmbQ,1,Took forever to get our food.
238,jMcRUW_MF8hM38p54QYmbQ,1, I will not recommend this place to anyone.
238,jMcRUW_MF8hM38p54QYmbQ,1,Service was ok
239,GPRiGy42hnJIWzdEib7mEw,4,This BurgerPalace is located along Virginia Beach Blvd. at the corner of Constitution Dr.
239,GPRiGy42hnJIWzdEib7mEw,4, This is in the Town Center area of the city.
239,GPRiGy42hnJIWzdEib7mEw,4, The place is easily visible from the road.
239,GPRiGy42hnJIWzdEib7mEw,4, There is ample parking on site as well.
239,GPRiGy42hnJIWzdEib7mEw,4, The outside of the place looks typical for all BurgerPalace locations I have seen.
239,GPRiGy42hnJIWzdEib7mEw,4," My visit here was on January 1, 2021.Let"
239,GPRiGy42hnJIWzdEib7mEw,4,'s start with Covid-19 protocols
239,GPRiGy42hnJIWzdEib7mEw,4,.
239,GPRiGy42hnJIWzdEib7mEw,4," Like most places, masks are required for entry and while not seated at your table.  Entry is also not permitted if you exhibit any symptoms related to Covid-19 as well."
239,GPRiGy42hnJIWzdEib7mEw,4, There is hand sanitizer available as you come in.
239,GPRiGy42hnJIWzdEib7mEw,4, Only select tables and booths are available to ensure proper social distancing.
239,GPRiGy42hnJIWzdEib7mEw,4,We got here around 12:15 pm that day for lunch.
239,GPRiGy42hnJIWzdEib7mEw,4, We were immediately greeted and seated when we came in.
239,GPRiGy42hnJIWzdEib7mEw,4, We went around the long way to our table to ensure social distancing.
239,GPRiGy42hnJIWzdEib7mEw,4," Once seated, Quinn came to the table to introduce herself, give us menus to look over, and asked what we wanted to drink."
239,GPRiGy42hnJIWzdEib7mEw,4," It had been a while since I had been to a BurgerPalace, so it took a little while to look through the menu."
239,GPRiGy42hnJIWzdEib7mEw,4,"After looking over the menu and the inserts, my mom and I decided to go with the 2 for $22 deal."
239,GPRiGy42hnJIWzdEib7mEw,4," For the starter, we went with the House Baked Soft Pretzels."
239,GPRiGy42hnJIWzdEib7mEw,4," For the entrees, we both went with the Classic Cheeseburger."
239,GPRiGy42hnJIWzdEib7mEw,4, We also added the Garden Salad bar as well.
239,GPRiGy42hnJIWzdEib7mEw,4,"Once ordered, we were able to go to the Garden Salad Bar."
239,GPRiGy42hnJIWzdEib7mEw,4, There are protocols in place here as well.
239,GPRiGy42hnJIWzdEib7mEw,4," It is self-service, but gloves and a new plate are required each time you go there (they are provided there for you)."
239,GPRiGy42hnJIWzdEib7mEw,4, The salad bar is actually pretty big with lots of different options.
239,GPRiGy42hnJIWzdEib7mEw,4, It turned out to be a really good beginning to lunch.
239,GPRiGy42hnJIWzdEib7mEw,4," A little bit after eating the salad items, the soft pretzels came out."
239,GPRiGy42hnJIWzdEib7mEw,4, The queso was a great dip to go along with it as well.
239,GPRiGy42hnJIWzdEib7mEw,4,"After about 10 minutes, the burgers came out to the table."
239,GPRiGy42hnJIWzdEib7mEw,4, The burgers were hot and the fries were as well.
239,GPRiGy42hnJIWzdEib7mEw,4, The burgers were cooked to order and juicy too.
239,GPRiGy42hnJIWzdEib7mEw,4, It was a really good meal overall for both of us.
239,GPRiGy42hnJIWzdEib7mEw,4, We were definitely full by the time we left.
239,GPRiGy42hnJIWzdEib7mEw,4,"Overall, this was a very good visit here."
239,GPRiGy42hnJIWzdEib7mEw,4, Service was on point and the food was great.
239,GPRiGy42hnJIWzdEib7mEw,4, I will definitely be coming back here in the future.
239,GPRiGy42hnJIWzdEib7mEw,4, They also have an e-mail rewards program.
239,GPRiGy42hnJIWzdEib7mEw,4," If you're in the Town Center area of the city, this place is still worth checking out for a meal."
240,EKT21Ok1YaFBCsMm2DwaFQ,1,Ordered Via UBER EATS - the delivery was prompt this review is strictly about the food service/meal.
240,EKT21Ok1YaFBCsMm2DwaFQ,1,The food was poorly packaged leading for sauce to leak all over the other containers and inside the bag.
240,EKT21Ok1YaFBCsMm2DwaFQ,1,"Side sauces were incorrect, missing drinks and parts of the order, lastly the food arrived barely warm."
240,EKT21Ok1YaFBCsMm2DwaFQ,1,Attempted to call the restaurant serval times - the automated answering machine redirected to the website and no availability to leave a voicemail.
241,nD436Br8-t35DQ1Z6UQE8w,1,Gave them another chance.
241,nD436Br8-t35DQ1Z6UQE8w,1,Waiters standing around and drinking alcohol on the job.
241,nD436Br8-t35DQ1Z6UQE8w,1,Ridiculous.
242,ZoEcGXIEg0hq9pp4xXqPBw,3,I ordered through grubhub the order arrived in 30 minutes fresh hot looking just like the picture I love their plating it's absolutely amazing sweet potato fries accompanied they were delicious and not too salty the  Crunchy chicken sandwich was still crunchy LA crunchy and cook 2 perfection season 2 perfectionhad bacon  Cheese.
242,ZoEcGXIEg0hq9pp4xXqPBw,3,nice soft toasted buttered roll.
242,ZoEcGXIEg0hq9pp4xXqPBw,3,I had a gift card that they seemed not to be able to accept anymore for some reason but I but I will order from them again when I don't feel like cooking
243,4BP-1cQjdhfQSEotSIUaYg,2,Terrible service despite restaurant being less than 50% full.
243,4BP-1cQjdhfQSEotSIUaYg,2,We were there 90 minutes for 2 kids meals and 2 adults.
243,4BP-1cQjdhfQSEotSIUaYg,2,Restaurant is at 50% capacity.
244,18Np3qMQVCETA5OC-Nfxhg,4,"Great dinner, fantastic service definitely the best we have had here in quite some time."
244,18Np3qMQVCETA5OC-Nfxhg,4,Our server Alexis was the best making recommendations and explaining everything.
244,18Np3qMQVCETA5OC-Nfxhg,4,She checked on us several times but not too many.
244,18Np3qMQVCETA5OC-Nfxhg,4,The full rack of baby back ribs were truly tender and did in fact fall off the bone.
244,18Np3qMQVCETA5OC-Nfxhg,4,The only item that was lacking was the upgraded Mac n cheese.
244,18Np3qMQVCETA5OC-Nfxhg,4,It had very little flavor.
244,18Np3qMQVCETA5OC-Nfxhg,4,Everything else was Great!
244,18Np3qMQVCETA5OC-Nfxhg,4,We will definitely be back and hope the improvements continue because we truly enjoy BurgerPalace menu.
245,ZK_sKIGautn4F9fiPdCmpw,1,This use to be a quality place to eat.
245,ZK_sKIGautn4F9fiPdCmpw,1, 
245,ZK_sKIGautn4F9fiPdCmpw,1,One of our favorites.
245,ZK_sKIGautn4F9fiPdCmpw,1, Today it was very wasn't.
245,ZK_sKIGautn4F9fiPdCmpw,1,Today it was extremely dirty.
245,ZK_sKIGautn4F9fiPdCmpw,1,The entry way stank and the glass was filthy.
245,ZK_sKIGautn4F9fiPdCmpw,1,"The lettuce on the bar was brown, half empty containers, unbelievably watery ranch dressing, and the glass cover was filthy."
245,ZK_sKIGautn4F9fiPdCmpw,1,Food in the floor.
245,ZK_sKIGautn4F9fiPdCmpw,1,Spatters of food on the side of unused tables.
245,ZK_sKIGautn4F9fiPdCmpw,1,Not to mention our waitress brought us our waters and we never saw her again.
245,ZK_sKIGautn4F9fiPdCmpw,1, I got up to get my own extra napkins and had to request the hostess (very sweet but young) to find our wayward waitress to give us our check.
245,ZK_sKIGautn4F9fiPdCmpw,1, Never again.
246,xTK189lKVWzHOfLzAUqeQQ,3,"Ok so hubby and I arrived and was sat quickly, waiter was good at first, until more people started arriving, seem like she was the only waiter although other waiters had come in."
246,xTK189lKVWzHOfLzAUqeQQ,3,"Had to remind for condiments I asked for, and also asked for extra napkins which never came, the waiter came back to our table clearly noticeable was our empty glasses, instead of asking if we need refills she asked if we needed to go boxes, I was literally chewing some food at the time, then the AC started blazing, clearly it was turned up."
246,xTK189lKVWzHOfLzAUqeQQ,3,We did get refills.
246,xTK189lKVWzHOfLzAUqeQQ,3,"I will say the salad bar is always on point the times I've visited any BurgerPalace they do pride themselves on that, so for that I will give 2 stars."
246,xTK189lKVWzHOfLzAUqeQQ,3,"Ok I will give 3 stars because they good about the Covid, however we probably won't be visiting any more of these establishments in the future."
247,SrCunsmh6EHZsc8fK7RGHw,5,"I don't expect much from chain restaurants which is why I have to say ""excellent job"" to this location."
247,SrCunsmh6EHZsc8fK7RGHw,5, We had a pleasant server and our food was literally some of the best on our whole vacation.
247,SrCunsmh6EHZsc8fK7RGHw,5, How unexpected was that???
247,SrCunsmh6EHZsc8fK7RGHw,5, We had a great meal at a very reasonable price and we left happy.
247,SrCunsmh6EHZsc8fK7RGHw,5, 
247,SrCunsmh6EHZsc8fK7RGHw,5,Thanks to the chef here for the great food and the staff for a job
247,SrCunsmh6EHZsc8fK7RGHw,5,well done!The
247,SrCunsmh6EHZsc8fK7RGHw,5,shrimp and sausage pasta dish was excellent by the way!
248,d0mnJRk4yI3Umo7JnNuZYw,5,Can't beat the bogo coupons they send.
248,d0mnJRk4yI3Umo7JnNuZYw,5,Burgers always good.
248,d0mnJRk4yI3Umo7JnNuZYw,5,We also like the ribs.
248,d0mnJRk4yI3Umo7JnNuZYw,5,Chicken Mac and cheese was surprisingly good too
249,VRMTxm9ppcn2FnDRkiViAQ,1,"The worst place to eat ever: looks dirty, ultra long wait to be served, the fries were very salted and tasted old oil."
249,VRMTxm9ppcn2FnDRkiViAQ,1,The waiter was incompetent.
249,VRMTxm9ppcn2FnDRkiViAQ,1,Avoid this place.
250,0kntC1sPj3qUeG8HozJ2MA,1,No response after emailing customer relations and providing information they requested.
251,ZY6eQLZvWIieMcTuYURYKg,4,"Don't sleep on BurgerPalace They have amazing ribs, salmon and chicken dinners!!"
251,ZY6eQLZvWIieMcTuYURYKg,4,"If you are craving a gray salad bar, they're the place for that too!"
251,ZY6eQLZvWIieMcTuYURYKg,4,BurgerPalace has amazing coupons and daily deals; and we're still trying to figure out how they stay in business when they give food away at crazy prices!
251,ZY6eQLZvWIieMcTuYURYKg,4,"Check it out, you won't be disappointed."
251,ZY6eQLZvWIieMcTuYURYKg,4,I gave them 4 stars because they closed the stores that were closed nearby!
252,PNlX74IV6qw9uubE4z8Eqw,1,Went there for lunch today and we both ordered the Garden Bar (we have always loved it).
252,PNlX74IV6qw9uubE4z8Eqw,1,It was below sub par.
252,PNlX74IV6qw9uubE4z8Eqw,1," Most, if not all, of the food on the bar was OLD."
