,review_id,review_rating,review_sentences
564,ytROt2YsBBQ7TDMON2pKLQ,1," BurgerPalace used to be good, and I understand the issue with a lack of help, but there were two workers standing at the entrance greeting people.  Perhaps they could have been more attentive."
564,ytROt2YsBBQ7TDMON2pKLQ,1, We won't be going back.
564,ytROt2YsBBQ7TDMON2pKLQ,1,Too bad.
565,BINYBvmcUjPL17PvRWt6xQ,1,This is the only BurgerPalace in the Rhode Island/Eastern Massachusetts area.
565,BINYBvmcUjPL17PvRWt6xQ,1,"Generally, we have been pleased with our past experiences at the BurgerPalaces we've dined at (including some that have closed.)This month"
565,BINYBvmcUjPL17PvRWt6xQ,1,", on a pleasant evening, we decided to make a special trip to this Wrentham location for dinner, arriving a little before 7:00."
565,BINYBvmcUjPL17PvRWt6xQ,1,THEY WERE CLOSED!
565,BINYBvmcUjPL17PvRWt6xQ,1,"We had used the iPhone Maps app, which posts their closing time as 9:00."
565,BINYBvmcUjPL17PvRWt6xQ,1,"Then I checked Google, which also lists their closing time as 9:00."
565,BINYBvmcUjPL17PvRWt6xQ,1,"Then I checked Yelp, which has the closing time as 10:00!!BurgerPalace itself has posted on Yelp."
565,BINYBvmcUjPL17PvRWt6xQ,1,They know about their listing there!Three major sites that people rely upon for hours of operation
565,BINYBvmcUjPL17PvRWt6xQ,1,are all wrong!
565,BINYBvmcUjPL17PvRWt6xQ,1,"If only one was wrong, that would be bad enough, but ALL THREE are off by several hours!"
565,BINYBvmcUjPL17PvRWt6xQ,1,"And CONTINUE to be!With gas at $5/gallon, we wasted money and time."
565,BINYBvmcUjPL17PvRWt6xQ,1,And our evening plans were ruined.
565,BINYBvmcUjPL17PvRWt6xQ,1,A word to the wise: DON'T GO TO THIS RUBY TUESDAY FOR DINNER.
565,BINYBvmcUjPL17PvRWt6xQ,1,You can't rely upon their posted hours.
565,BINYBvmcUjPL17PvRWt6xQ,1,"If a zero-star rating was possible, that's what we would give this BurgerPalace experience."
565,BINYBvmcUjPL17PvRWt6xQ,1," By definition, food doesn't get worse than NO food, and service doesn't get worse than NO"
565,BINYBvmcUjPL17PvRWt6xQ,1,serviceHopefully
565,BINYBvmcUjPL17PvRWt6xQ,1,", all the hours of operations will be corrected soon, so others won't have the same aggravating experience."
565,BINYBvmcUjPL17PvRWt6xQ,1,"Or better yet, BurgerPalace could stay open until at least 9:00."
566,vBSKm34_3xti93Q3iBmoyw,1,Last Tuesday my girlfriend made a Reservation for the out side seating  for this Friday  and said we have small dog .
566,vBSKm34_3xti93Q3iBmoyw,1,The person on the phone said dog are allowed and we have  Reservations outside .
566,vBSKm34_3xti93Q3iBmoyw,1,Today we went there for 3:30 we were told they don't do Reservations and they don't allow dogs event out side  even though guy on phone said the allow  dogs and said Reservations are all set.
566,vBSKm34_3xti93Q3iBmoyw,1,THEY SHOULD train there  employees  on protocol and rules .
566,vBSKm34_3xti93Q3iBmoyw,1, So don't wast your time there when there own Employees don't know the rules about town people certain information that is required.
567,GGCn_t8mVfVXooCd7IwHbQ,2,We were a party of 11 and it was a friend bday.
567,GGCn_t8mVfVXooCd7IwHbQ,2,Our food came out at different times and my food by the time it came out everyone was done eating (and I ordered the same food as 2 people at my table).
567,GGCn_t8mVfVXooCd7IwHbQ,2,Other people who arrived after us got our food before us.
567,GGCn_t8mVfVXooCd7IwHbQ,2,The manager gave us a discount and apologized which was appreciated.
567,GGCn_t8mVfVXooCd7IwHbQ,2,Our waitress avoided us and didn't give us an explanation as to why the food was delayed.
567,GGCn_t8mVfVXooCd7IwHbQ,2,It felt like as soon as she knew we were getting irritated she stopped trying because she barely came to our table.
567,GGCn_t8mVfVXooCd7IwHbQ,2,As a result of her poor communication (the food late isn't her fault) it affected her tip.
567,GGCn_t8mVfVXooCd7IwHbQ,2,I've worked in food for 10+ years.
567,GGCn_t8mVfVXooCd7IwHbQ,2,You need to inform the customer and help them understand.
567,GGCn_t8mVfVXooCd7IwHbQ,2,Turns out a bunch of late orders came in as soon as we sat down - that's why the food was late.
567,GGCn_t8mVfVXooCd7IwHbQ,2,So the waitress definitely should have informed us.
567,GGCn_t8mVfVXooCd7IwHbQ,2,She was young so maybe it was her first time...?
567,GGCn_t8mVfVXooCd7IwHbQ,2,Idk but honestly we spend an hour and a half there and I'll never go again.
567,GGCn_t8mVfVXooCd7IwHbQ,2,Kudos to the manager for owning up to it and giving us compensation.
568,-xoKYqVZRqGkxmEOn8g08w,2,"When I walked in, waiters were not ready and had to wait when the restaurant was empty."
568,-xoKYqVZRqGkxmEOn8g08w,2,They were out pizza and queso.
568,-xoKYqVZRqGkxmEOn8g08w,2,"I walked up to the salad bar and almost all the plates from the ""clean"" pile were dirty."
568,-xoKYqVZRqGkxmEOn8g08w,2,Food was ok.
568,-xoKYqVZRqGkxmEOn8g08w,2,Not very good overall
569,gfvWCDwxcsY4iXAy5YXy0w,4,"I belong to their ""So Connected"" email club so from time to time I receive coupons via email for discounts and deals on the food here."
569,gfvWCDwxcsY4iXAy5YXy0w,4,Well this past weekend I received a coupon for buy one meal get one half off so my mother and I made the trip to the restaurant to put the coupon to use.
569,gfvWCDwxcsY4iXAy5YXy0w,4,We both got the hamburger meal and we both added the all-you-can-eat salad bar to our meals for a $5.99 upcharge.
569,gfvWCDwxcsY4iXAy5YXy0w,4,"The salad bar is a meal in itself, always with lots of choices and fresh ingredients."
569,gfvWCDwxcsY4iXAy5YXy0w,4,"I did notice this visit that the salad bar was missing both croutons and bacon bits, two of my favorite ingredients to a salad, so I was a bit disappointed but there were still plenty of other delicious ingredients to add to my salad so I was still pretty satisfied with the salad bar."
569,gfvWCDwxcsY4iXAy5YXy0w,4,On my last two visits I have noticed items missing from the salad bar but I am wondering if the reason may be that because the restaurant closes rather early on Sundays (we usually get there around 4 PM and they close down at 6 PM) they might not replenish things that run out on the salad bar around that time of the day.
569,gfvWCDwxcsY4iXAy5YXy0w,4,But of course that is just a theory.
569,gfvWCDwxcsY4iXAy5YXy0w,4,We both enjoyed our meals and the salad bar as an add-on really hit the spot.
569,gfvWCDwxcsY4iXAy5YXy0w,4,I noticed this time they have a new menu and they added some new items and took away others such as the hamburger sliders/salad bar combo which I used to order quite often (I hate to see that option go).
569,gfvWCDwxcsY4iXAy5YXy0w,4,A lot of the items featured on the new menu are the same as before but I did see a few changes.
569,gfvWCDwxcsY4iXAy5YXy0w,4,"Anyway, I am glad I got to visit the restaurant this weekend and I really did enjoy my meal!"
570,SylHywddSRipK8-B_PJpbA,1,We went today for lunch!
570,SylHywddSRipK8-B_PJpbA,1,Our waitress was Myisha and she was terrible!
570,SylHywddSRipK8-B_PJpbA,1,First we waited forever then I think she heard us complain so she finally came over and that was the last time we saw her until we got our check!
570,SylHywddSRipK8-B_PJpbA,1,Someone else brought our food!
570,SylHywddSRipK8-B_PJpbA,1, She brought my husband a plastic knife and fork to eat a steak.
570,SylHywddSRipK8-B_PJpbA,1,.
570,SylHywddSRipK8-B_PJpbA,1,And gave everyone around us real silverware.
570,SylHywddSRipK8-B_PJpbA,1, She had the personality of a door knob!
570,SylHywddSRipK8-B_PJpbA,1,The steak should have been med rare but was well done!
570,SylHywddSRipK8-B_PJpbA,1, Then my salad tasted like paper!
570,SylHywddSRipK8-B_PJpbA,1,The ranch had no flavor!
570,SylHywddSRipK8-B_PJpbA,1, 
570,SylHywddSRipK8-B_PJpbA,1,Needless to say... we won't be back!
570,SylHywddSRipK8-B_PJpbA,1,It was really bad!
570,SylHywddSRipK8-B_PJpbA,1, A waste of $30
571,xebLAMPRwCFLmgS2obQL4A,1,This restaurant is on its last legs.
571,xebLAMPRwCFLmgS2obQL4A,1,  Old oil in the fryer; food incorrectly made; servers and a manager who just don't care.
571,xebLAMPRwCFLmgS2obQL4A,1,"  While there are limited food options at Wrentham Outlets, anything is better than this."
572,fFKKIK6yspzynCt0T_qMuQ,2,No with you to post it this time went to take a client to lunch for his birthday only to find out the restaurant had closed supposedly temporarily I normally don't always go there because of a past experiences but it's just too much.
572,fFKKIK6yspzynCt0T_qMuQ,2,It would've been nice to see it posted online that they were closed and not just wait to you get to the door
573,kNYqrz8XXk6vP6rEJ1XfGA,3,I liked this place in the past ;but they havent been open for weeks.
573,kNYqrz8XXk6vP6rEJ1XfGA,3,Might be out of buisness
574,R1LIfgzaJOYKRQnCSv3YAQ,5,another amazing visit with my family!!!
574,R1LIfgzaJOYKRQnCSv3YAQ,5,jaden was exceptional & so was dru she was awesome too!!!
574,R1LIfgzaJOYKRQnCSv3YAQ,5,we will keep coming back!!!
575,wECcXKowVFx8X9sOaitGYw,5,RT has the BEST salad bar anywhere!
575,wECcXKowVFx8X9sOaitGYw,5,And I love the bourbon hickory salmon.
575,wECcXKowVFx8X9sOaitGYw,5,Comes with sides of rice pilaf and grilled Zucchini.
575,wECcXKowVFx8X9sOaitGYw,5,Delicious!
575,wECcXKowVFx8X9sOaitGYw,5,We like to fill up on the salad bar and take our entree home for another meal.
575,wECcXKowVFx8X9sOaitGYw,5,Good way to get more bang for the buck.
575,wECcXKowVFx8X9sOaitGYw,5,And they put out buy one get one entree coupons.
575,wECcXKowVFx8X9sOaitGYw,5,What a deal!
576,nf3Ac0JQY30Fi20Mp-8XeA,5,Friendly staff and short wait.
576,nf3Ac0JQY30Fi20Mp-8XeA,5,The garden bar is always my favorite.
576,nf3Ac0JQY30Fi20Mp-8XeA,5,I also like the appetizer sampler and the others with me loved their burgers they ordered.
577,sRec1H7WUbUf7StpnrfIqg,1,Over priced and the food tasted less then ok.
577,sRec1H7WUbUf7StpnrfIqg,1,Was over $60 for 2 kids meals and 2 adult meals.
577,sRec1H7WUbUf7StpnrfIqg,1, They didn't take the tails off my daughters shrimp before frying it.
577,sRec1H7WUbUf7StpnrfIqg,1,I ate half my burger and my husband ate maybe half of his salmon salad.
577,sRec1H7WUbUf7StpnrfIqg,1,Service was all over the place.
577,sRec1H7WUbUf7StpnrfIqg,1,Our waiter asked if we were ready for our bill before we even got our food.
578,Al7-H0GiIk1dyulzyTbVPg,2,"When I walked in, I wasn't greeted but I was seated immediately."
578,Al7-H0GiIk1dyulzyTbVPg,2,The decor looked like something straight out of the 70's.
578,Al7-H0GiIk1dyulzyTbVPg,2,"The service was nice, but not fairly attentive."
578,Al7-H0GiIk1dyulzyTbVPg,2,I tried the salmon dish and felt my blood pressure rising with the first salty bite.
578,Al7-H0GiIk1dyulzyTbVPg,2,"The rib dish was okay, however."
578,Al7-H0GiIk1dyulzyTbVPg,2,Now the service was lackluster at best.
578,Al7-H0GiIk1dyulzyTbVPg,2,We had to keep flagging the server down and it took her almost 30 Minutes to acknowledge that our card had been on the table for us to pay.
578,Al7-H0GiIk1dyulzyTbVPg,2,"2 tables came after us, ate, and paid before we were able to leave."
579,DJVTczU2QG3pBsgZ41j9kg,1,We don't have a BurgerPalace where I amFrom so I convinced my husband for us to go out to dinner.
579,DJVTczU2QG3pBsgZ41j9kg,1,He had just gotten off work and re arrive around 5-5:15 we got sat at a table and right away no one came to us for about 10 minutes.
579,DJVTczU2QG3pBsgZ41j9kg,1,"I am a server so I went up to the host stand and waited for the host to get back, while I was waiting 3 other servers just stared at me."
579,DJVTczU2QG3pBsgZ41j9kg,1,When the host came back I told him we haven't seen anyone and he just looked confused so I just said thank you and walked back to our table.
579,DJVTczU2QG3pBsgZ41j9kg,1,We finally ended up getting a waitress but my husband ordered a beer in a bottle and I had to ask another server after 20 minutes for it.
579,DJVTczU2QG3pBsgZ41j9kg,1,We saw our server 2 times.
579,DJVTczU2QG3pBsgZ41j9kg,1,1 to take our order and one to hover over us with the check.
579,DJVTczU2QG3pBsgZ41j9kg,1,I didn't want to tip much because it was awful and I wanted to speak to the manager but the server handed my husband the ticket then stood there and put him under pressure.
579,DJVTczU2QG3pBsgZ41j9kg,1,I am not by any means trying to tell anyone how to do their job and we didn't act rude but it was the worst service I have ever had by far.
579,DJVTczU2QG3pBsgZ41j9kg,1,The other server in the section next to us was delightful.
580,GLO67nhXKSBeWR9W446kGQ,2,Ate here today (6-25-21).
580,GLO67nhXKSBeWR9W446kGQ,2,"My ""Top Shelf"" margarita, which cost $10, was very watered down."
580,GLO67nhXKSBeWR9W446kGQ,2,"My cheeseburger, which took a long time to arrive, was lukewarm."
581,7cEC3qLWzEf0Z4ZNllJJmA,1,Be forewarned!
581,7cEC3qLWzEf0Z4ZNllJJmA,1,This is NOT the place to go for good food.
581,7cEC3qLWzEf0Z4ZNllJJmA,1,We (my wife and I) ate here today and was EXTREMELY disappointed.
581,7cEC3qLWzEf0Z4ZNllJJmA,1, Here are the following FAILED grades:1) Wait staff not consistently wearing masks.
581,7cEC3qLWzEf0Z4ZNllJJmA,1, I had to ask our waitress to pull hers up when she came to our table2) I ordered their 6 oz Sirloin Medium Rare.
581,7cEC3qLWzEf0Z4ZNllJJmA,1, It was served cooked well done...actually waaaay overdone.
581,7cEC3qLWzEf0Z4ZNllJJmA,1," It was inedible, like a hockey puck."
581,7cEC3qLWzEf0Z4ZNllJJmA,1, I did not eat it3)
581,7cEC3qLWzEf0Z4ZNllJJmA,1,I ordered a baked potato with butter only...it was served with sour cream only.
581,7cEC3qLWzEf0Z4ZNllJJmA,1,I do not like sour cream on my potato.
581,7cEC3qLWzEf0Z4ZNllJJmA,1,I did not eat it4)
581,7cEC3qLWzEf0Z4ZNllJJmA,1,We had to ask for salt 5) The spinach artichoke dip was watery and tasteless.6)
581,7cEC3qLWzEf0Z4ZNllJJmA,1,My wife's broccoli was very salty.
581,7cEC3qLWzEf0Z4ZNllJJmA,1, She did not eat it.
581,7cEC3qLWzEf0Z4ZNllJJmA,1,I told our waitress about the overdone steak and the potato and she asked what I wanted to do about it.
581,7cEC3qLWzEf0Z4ZNllJJmA,1," I told her at least take my plate off the bill, which they did."
581,7cEC3qLWzEf0Z4ZNllJJmA,1, Then I asked to see the manager and was told he was very busy helping in the kitchen as they were short staffed today.
581,7cEC3qLWzEf0Z4ZNllJJmA,1, I think that is the answer to my poor serving.
581,7cEC3qLWzEf0Z4ZNllJJmA,1," Also, since no one was actively supervising the staff, they felt free to wander around without their masks on."
581,7cEC3qLWzEf0Z4ZNllJJmA,1,This was the worst experience I have had in a restaurant in years.
581,7cEC3qLWzEf0Z4ZNllJJmA,1," It is doubtful that I will eat there again unless all I want is their salad bar, which was very tasty."
581,7cEC3qLWzEf0Z4ZNllJJmA,1," Therefore, all I had for dinner was a salad and some corn."
581,7cEC3qLWzEf0Z4ZNllJJmA,1,Good luck if you eat here.
581,7cEC3qLWzEf0Z4ZNllJJmA,1, 
581,7cEC3qLWzEf0Z4ZNllJJmA,1,Be prepared to not get anything like you expected.
581,7cEC3qLWzEf0Z4ZNllJJmA,1, I didn't bother asking for a new plate because of the nearly half hour wait to begin with.
582,-1DIQjCw_x-xQPIzf7llmA,1,Ribeye steak was extremely tough and had so much oil it just streams down your throat like drinking Wesson oil.
582,-1DIQjCw_x-xQPIzf7llmA,1,Traded it back for loaded chicken nachos which the manager brought herself and apparently she took offense to how horrible I said the steak was because there was barely anything on the $10.99 nachos so I cut my losses and had chips for $11 +.
582,-1DIQjCw_x-xQPIzf7llmA,1,"Friend had ribs, shrimp, fries, chicken tenders and zucchini."
582,-1DIQjCw_x-xQPIzf7llmA,1,"Ribs were not good, shrimp wasn't really shrimp it's the cheap knockoff."
582,-1DIQjCw_x-xQPIzf7llmA,1,5 little zucchini slices.
582,-1DIQjCw_x-xQPIzf7llmA,1,Fries and chicken tenders are good and the tea is really great.
582,-1DIQjCw_x-xQPIzf7llmA,1,If the manager had cared we would have been back.
582,-1DIQjCw_x-xQPIzf7llmA,1,People don't care about customers who keep the company in business which keeps them employed.
582,-1DIQjCw_x-xQPIzf7llmA,1,We won't be back.
583,-6vtZgrFDU1r19ivSi1H0w,2,The Crispy Chicken Sandwich has delicious chicken breast but the pimento topping was too salty.
583,-6vtZgrFDU1r19ivSi1H0w,2,A lot.
583,-6vtZgrFDU1r19ivSi1H0w,2,"Delicious Garden Bar; quite nice romaine, spinach, and salad mix, large selection of trendy toppings."
583,-6vtZgrFDU1r19ivSi1H0w,2,Very friendly server.
584,A0YQzNy7Z1OEraQBMhqKsg,1,I guess I have to choose one star.
584,A0YQzNy7Z1OEraQBMhqKsg,1, Nothing lower.  The takeout pictures really speak for themselves.
584,A0YQzNy7Z1OEraQBMhqKsg,1, Paid over $100.
585,r-3ggTIkzIX0ohZRLWTZaA,1,Monday at 4:pm .
585,r-3ggTIkzIX0ohZRLWTZaA,1,"Food took 40 minutes, only one other couple sitting in the restaurant and they had already gotten food when we ordered."
585,r-3ggTIkzIX0ohZRLWTZaA,1,We ordered 3 kids burgers with fry's and a grilled chicken sandwich (soggy bun) with tater tots.
585,r-3ggTIkzIX0ohZRLWTZaA,1,Should'nt take 40 min.
585,r-3ggTIkzIX0ohZRLWTZaA,1,"I got the salad bar, I got the last ""clean plate"" no good lettuce,"
585,r-3ggTIkzIX0ohZRLWTZaA,1,"The other type of lettuce was brown, the waitress was sweet and friendly."
585,r-3ggTIkzIX0ohZRLWTZaA,1,"It was so slow the staff were all sitting around the bar chatting, music was sooo loud I couldn't hear anyone talking around the table, she kindly turned it down after I asked, worst music selection ever, then it was turned back up 5 min later."
585,r-3ggTIkzIX0ohZRLWTZaA,1,We will not be coming back.
585,r-3ggTIkzIX0ohZRLWTZaA,1,Oh and the bathroom was disgusting!
586,5TjLpJlDUUFZb5YUa9mMpQ,1,We were in Cadillac on Thursday and wanted to have a nice sit down lunch.
586,5TjLpJlDUUFZb5YUa9mMpQ,1, We did get to sit down.
586,5TjLpJlDUUFZb5YUa9mMpQ,1, We sat for over 15 min. before the waitress decided to come to our table.
586,5TjLpJlDUUFZb5YUa9mMpQ,1,There were not many people but some of them we watched her visit 3 times before coming to take our drink order.
586,5TjLpJlDUUFZb5YUa9mMpQ,1," Order was not right and beware of ordering the mushrooms on your steak,  they use it to hide the steak with more fat and gristle than meat."
586,5TjLpJlDUUFZb5YUa9mMpQ,1, As we had been on the road several hours and were very hungry we ate what we could even though most of it was cold.  We had to flag waitress down to get check so we could leave.  I really wish the waitress would have taken the hair scrunchie off her wrist and tied up her long hair.
587,VRoLD9J5NrvOaL8eF_ns9Q,1,We were driving back from Traverse City and wanted to sit down to eat.
587,VRoLD9J5NrvOaL8eF_ns9Q,1,"As we walked in, there we tons of signs promising scan codes of menus and there was a table just to recruit new workers."
587,VRoLD9J5NrvOaL8eF_ns9Q,1,"We were immediately seated with regular plastic menus and as we looked around, there was no one else dining in the restaurant."
587,VRoLD9J5NrvOaL8eF_ns9Q,1,That should have been the first clue.
587,VRoLD9J5NrvOaL8eF_ns9Q,1,"My husband ordered a Shiner Bock, but the waitress said they didn't have it, it wasn't on tap and had no clue what it was, although it was listed right there on the menu."
587,VRoLD9J5NrvOaL8eF_ns9Q,1,The plastic menus were ripped an old... how would she not know?
587,VRoLD9J5NrvOaL8eF_ns9Q,1,He finally settled on one of the five beers she did know: Sam Adams Summer Ale.
587,VRoLD9J5NrvOaL8eF_ns9Q,1,"So, we ordered from an extremely pared down menu and she brought out my husband's beer."
587,VRoLD9J5NrvOaL8eF_ns9Q,1,He took his first sip and it was flat and warm.
587,VRoLD9J5NrvOaL8eF_ns9Q,1,There was barely any head on it and no moisture on the outside of the glass.
587,VRoLD9J5NrvOaL8eF_ns9Q,1,"After going over their blah menu, dealing with their snippy and unknowledgeable waitress, then receiving a warm beer that was flat, we just left."
587,VRoLD9J5NrvOaL8eF_ns9Q,1,"If they couldn't keep their beer at temperature, would they be able to cook their food to temperature to ensure safety?"
587,VRoLD9J5NrvOaL8eF_ns9Q,1,We didn't want to chance it.
587,VRoLD9J5NrvOaL8eF_ns9Q,1,Won't be back.
588,Y6a_XNZRpnf-Y-K98tpC2A,1,Hesitated stopping here on a recent Sunday visit to Cadillac.
588,Y6a_XNZRpnf-Y-K98tpC2A,1,"Very few cars in the lot, was expecting quick and quiet meal."
588,Y6a_XNZRpnf-Y-K98tpC2A,1," After standing at the front door for a few minutes, the hostess asked us to wait a minute to clean off a table."
588,Y6a_XNZRpnf-Y-K98tpC2A,1," There were very few patrons in the restaurant, not sure why another table wasn't ready and  available."
588,Y6a_XNZRpnf-Y-K98tpC2A,1," After she walked away, she returned a few minutes later and said it would be 10-15 minutes before a table would be ready.  A quick scan of the entire restaurant showed 5 tables in use, far far below any covid restrictions."
588,Y6a_XNZRpnf-Y-K98tpC2A,1, 
588,Y6a_XNZRpnf-Y-K98tpC2A,1,When I asked why we couldn't sit at one of the other available tables she said that wasn't possible.
588,Y6a_XNZRpnf-Y-K98tpC2A,1, I politely said I was not waiting and she said 'OK'.
588,Y6a_XNZRpnf-Y-K98tpC2A,1," Several of their restaurants have closed, its certainly not an easy business.  Unfortunately one more example of the wrong person at the front door."
589,lL8dyhtpajjFtk39o_RgOQ,2,"With the buy one get one special coupon in hand, I decided to give them another go."
589,lL8dyhtpajjFtk39o_RgOQ,2," Due to the rona, I used curbside pickup."
589,lL8dyhtpajjFtk39o_RgOQ,2," The curbside system when using a coupon could use some tweaking, such as being able to use the coupon with online ordering instead of requiring the order to be phoned in, and some way to make payment without personal contact."
589,lL8dyhtpajjFtk39o_RgOQ,2," Food wise, not much has changed."
589,lL8dyhtpajjFtk39o_RgOQ,2, 
589,lL8dyhtpajjFtk39o_RgOQ,2,Ordered steaks/baked potato/salad.
589,lL8dyhtpajjFtk39o_RgOQ,2," The steaks, while cooked as ordered, were completely without flavor."
589,lL8dyhtpajjFtk39o_RgOQ,2, No flavor.
589,lL8dyhtpajjFtk39o_RgOQ,2, No seasoning.
589,lL8dyhtpajjFtk39o_RgOQ,2, Zero flavor.
589,lL8dyhtpajjFtk39o_RgOQ,2, How do you kill the flavor of a steak?
589,lL8dyhtpajjFtk39o_RgOQ,2," Even when effectively half price, I still felt somewhat cheated."
589,lL8dyhtpajjFtk39o_RgOQ,2," Maybe burgers are their thing, but it's not steaks."
590,g8Z1nj1_Yatd7lmDD7vM5w,2,First time at this BurgerPalace
590,g8Z1nj1_Yatd7lmDD7vM5w,2,All the staff were very friendly and the restaurant appeared to be clean.
590,g8Z1nj1_Yatd7lmDD7vM5w,2,It wasn't too busy for it being a Saturday night.
590,g8Z1nj1_Yatd7lmDD7vM5w,2,I observed the salad bar and it was pretty sad.
590,g8Z1nj1_Yatd7lmDD7vM5w,2,A lot of stuff was pretty low and it didn't look like any of the staff were concerned about it.
590,g8Z1nj1_Yatd7lmDD7vM5w,2,I ordered the grilled chicken salad and my guest had the 8 oz sirloin.
590,g8Z1nj1_Yatd7lmDD7vM5w,2,Our waiter was at attentive and overly friendly.
590,g8Z1nj1_Yatd7lmDD7vM5w,2,However after receiving our food the drink refills went down.
590,g8Z1nj1_Yatd7lmDD7vM5w,2,I waited over 10 minutes before I got my water refilled.
590,g8Z1nj1_Yatd7lmDD7vM5w,2,Nothing special about the food.
590,g8Z1nj1_Yatd7lmDD7vM5w,2,The grilled chicken salad was $12 and to be honest Zaxby's has a bigger and more ingredients in their salads and it's $8.
590,g8Z1nj1_Yatd7lmDD7vM5w,2,My guest said the steak was very chewy and was bland.
590,g8Z1nj1_Yatd7lmDD7vM5w,2,Not impressed with this restaurant and won't be back.
590,g8Z1nj1_Yatd7lmDD7vM5w,2,"Looking for a great salad, go to Zaxby's up the street."
591,IQsdSEkO8-aPuWMcUy-mCg,1,"You would think a national brand BurgerPalace would be concerned about food and customer service, guess not."
591,IQsdSEkO8-aPuWMcUy-mCg,1," Went for lunch ordered the special cheeseburger, restaurant maybe 50 % full, 37 minutes later the cheeseburger finally showed up.  Thought this was a rather long wait so went back 2 weeks later with some friends and ordered the special, cheeseburger with extra tots."
591,IQsdSEkO8-aPuWMcUy-mCg,1, 35 minutes later and we finally started getting our food.
591,IQsdSEkO8-aPuWMcUy-mCg,1, I will say RT makes a very good burger BUT 35 minutes is far to long.  Mentioned the long wait to the manager and all we got was shrugged shoulders.
591,IQsdSEkO8-aPuWMcUy-mCg,1, 
591,IQsdSEkO8-aPuWMcUy-mCg,1,"Went today for the salad bar special (no wait for a salad bar) another person order mac and cheese and a bowl of broccoli and 30 minutes went buy before her food came, RT was maybe 40% full."
591,IQsdSEkO8-aPuWMcUy-mCg,1, Would have mentioned or should say compline to the manager but he was too busy socializing.
591,IQsdSEkO8-aPuWMcUy-mCg,1, Since this is one of the few places in Lenoir to eat lunch other than McDonalds it's sad.
591,IQsdSEkO8-aPuWMcUy-mCg,1, But I'll take my money elsewhere.
591,IQsdSEkO8-aPuWMcUy-mCg,1, My best advice unless you have a good hour or more eat anywhere else but here.
592,1GAhn55wasZ7KRAPKbbrzA,5,We have recently started visiting BurgerPalace near Health Park in Ft. Myers.
592,1GAhn55wasZ7KRAPKbbrzA,5,They have been offering great specials and you can't beat the prices.
592,1GAhn55wasZ7KRAPKbbrzA,5, We normally have a drink or 2 and then order food to go.
592,1GAhn55wasZ7KRAPKbbrzA,5, We have had excellent service in the bar area.
592,1GAhn55wasZ7KRAPKbbrzA,5," Nate, the bartender, has been our server and we have always had great service with him."
592,1GAhn55wasZ7KRAPKbbrzA,5," The food is always consistent and tastes fantastic,"
592,1GAhn55wasZ7KRAPKbbrzA,5,The specials are priced lower than any restaurants I have been to.
592,1GAhn55wasZ7KRAPKbbrzA,5, They have a great endless salad bar which is also reasonably priced.
592,1GAhn55wasZ7KRAPKbbrzA,5, You can add it to your meal for a nominal fee.
592,1GAhn55wasZ7KRAPKbbrzA,5,Check the specials before you go!
592,1GAhn55wasZ7KRAPKbbrzA,5,"If you sit at the bar, I would recommend having Nate as your server!"
592,1GAhn55wasZ7KRAPKbbrzA,5, We will be back.
